{
  "$schema": "./food-source-manifest.schema.json",
  "manifestVersion": 4,
  "templateOnly": true,
  "releaseClass": "live-reviewed",
  "evidenceBundle": null,
  "source": {
    "code": "HEALTH_CANADA_CNF",
    "displayName": "Health Canada Canadian Nutrient File",
    "kind": "government",
    "homepageUrl": "https://www.canada.ca/en/health-canada/services/food-nutrition/healthy-eating/nutrient-data/canadian-nutrient-file-about-us.html",
    "accessUrl": "https://open.canada.ca/data/en/dataset/1b6139bd-ed7e-4043-bc28-ff00e10f3109"
  },
  "release": {
    "releaseKey": "cnf-2026-resource-019f2a90-e3a9-489d-b6e1-f74f4ba1d006",
    "publishedOn": "2026-05-14",
    "acquiredAt": null,
    "upstreamSchemaVersion": null
  },
  "artifact": {
    "downloadUrl": "https://open.canada.ca/data/dataset/1b6139bd-ed7e-4043-bc28-ff00e10f3109/resource/019f2a90-e3a9-489d-b6e1-f74f4ba1d006/download/cnf_fcen_all-files-data_2026.zip",
    "permittedResolvedUrls": [
      "https://open.canada.ca/data/dataset/1b6139bd-ed7e-4043-bc28-ff00e10f3109/resource/019f2a90-e3a9-489d-b6e1-f74f4ba1d006/download/cnf_fcen_all-files-data_2026.zip",
      "https://opencanada.blob.core.windows.net/opengovprod/resources/019f2a90-e3a9-489d-b6e1-f74f4ba1d006/cnf_fcen_all-files-data_2026.zip"
    ],
    "objectUri": null,
    "mediaType": "application/zip",
    "sha256": null,
    "byteSize": null,
    "publisherIntegrity": {
      "publisherProvidesSha256": false,
      "sha256": null,
      "sha256EvidenceUrl": null,
      "exactByteSize": null,
      "reportedSize": null,
      "metadataUrl": "https://open.canada.ca/data/api/action/package_show?id=1b6139bd-ed7e-4043-bc28-ff00e10f3109",
      "notes": "The publisher metadata leaves the aggregate ZIP hash empty and size null. A 2026-08-15 HEAD observation returned 26656195 bytes; that transport observation is not an acquired-artifact size or publisher checksum."
    }
  },
  "rights": {
    "licenseExpression": "LicenseRef-Open-Government-Licence-Canada-2.0",
    "licenseName": "Open Government Licence — Canada 2.0",
    "licenseUrl": "https://open.canada.ca/en/open-government-licence-canada",
    "termsUrl": "https://open.canada.ca/en/open-government-licence-canada",
    "commercialUseAllowed": true,
    "redistributionAllowed": true,
    "licenseAttributionRequired": true,
    "productAttributionRequired": true,
    "attributionFixture": "Source: Health Canada, Canadian Nutrient File 2026. Contains information licensed under the Open Government Licence — Canada.",
    "databaseRightsNotes": "The licence permits commercial copying, modification, publication, translation, adaptation, and distribution with source acknowledgement. It excludes third-party rights, marks, and official symbols and prohibits implying endorsement.",
    "review": {
      "status": "pending",
      "reviewedAt": null,
      "reviewedBy": null,
      "evidenceUrls": [
        "https://www.canada.ca/en/health-canada/services/food-nutrition/healthy-eating/nutrient-data/canadian-nutrient-file-about-us.html",
        "https://open.canada.ca/data/en/dataset/1b6139bd-ed7e-4043-bc28-ff00e10f3109",
        "https://open.canada.ca/data/api/action/package_show?id=1b6139bd-ed7e-4043-bc28-ff00e10f3109",
        "https://open.canada.ca/en/open-government-licence-canada"
      ],
      "notes": "Official-source research is complete; named product-rights approval, attribution rendering, and acquisition verification are still required."
    }
  },
  "ingestion": {
    "parserPackage": "@nutrition-tracker/ingestion",
    "parserVersion": null,
    "parserBuildSha256": null,
    "dataTypes": ["foods", "nutrients", "nutrient amounts", "measure weights", "food groups"],
    "languages": ["en", "fr"],
    "markets": ["CA"],
    "sourceIdentityFields": ["food code"],
    "missingValuePolicy": "absent-is-unknown-never-zero"
  },
  "validation": {
    "rules": [
      "English and French identities remain paired by source food code",
      "every nutrient symbol and unit maps explicitly or is quarantined",
      "measure-weight relationships reference an existing food",
      "missing and trace markers retain their source meaning",
      "food and nutrient counts are compared with official release metadata",
      "attribution fixture renders in food detail and export tests"
    ],
    "expectedFiles": [
      "Food_Name.csv",
      "Food_Source.csv",
      "CNF_Food_Group.csv",
      "Nutrient_Amount.csv",
      "Nutrient_Name.csv",
      "Nutrient_Source.csv",
      "Measure_Weight_Conversion.csv",
      "Measure_Type.csv",
      "Measure_Name.csv"
    ],
    "releaseSpecificExpectations": {
      "officialFoodCount": 5993,
      "officialMaximumNutrientCount": 173,
      "officialDatasetPublishedOn": "2026-05-14",
      "officialRecordReleasedOn": "2026-05-19",
      "officialRecordModifiedOn": "2026-06-03",
      "officialAggregateResourceCreatedAt": "2026-06-03T18:13:36.116325",
      "officialAggregateResourceLastModifiedAt": "2026-06-03T18:10:27.842642",
      "observedHeadContentLengthOn2026_08_15": 26656195
    }
  }
}
