{
  "$schema": "./food-source-manifest.schema.json",
  "manifestVersion": 4,
  "templateOnly": true,
  "releaseClass": "live-reviewed",
  "evidenceBundle": null,
  "source": {
    "code": "USDA_FDC",
    "displayName": "USDA FoodData Central",
    "kind": "government",
    "homepageUrl": "https://fdc.nal.usda.gov/",
    "accessUrl": "https://fdc.nal.usda.gov/download-datasets/"
  },
  "release": {
    "releaseKey": "FoodData_Central_csv_2026-04-30",
    "publishedOn": "2026-04-30",
    "acquiredAt": null,
    "upstreamSchemaVersion": null
  },
  "artifact": {
    "downloadUrl": "https://fdc.nal.usda.gov/fdc-datasets/FoodData_Central_csv_2026-04-30.zip",
    "permittedResolvedUrls": [
      "https://fdc.nal.usda.gov/fdc-datasets/FoodData_Central_csv_2026-04-30.zip"
    ],
    "objectUri": null,
    "mediaType": "application/zip",
    "sha256": null,
    "byteSize": null,
    "publisherIntegrity": {
      "publisherProvidesSha256": false,
      "sha256": null,
      "sha256EvidenceUrl": null,
      "exactByteSize": null,
      "reportedSize": "460M zipped; 3.1G unzipped",
      "metadataUrl": "https://fdc.nal.usda.gov/download-datasets/",
      "notes": "The release table publishes approximate display sizes but no cryptographic checksum. A 2026-08-15 HEAD observation returned 481510693 bytes; that transport observation is not an acquired-artifact size or publisher checksum."
    }
  },
  "rights": {
    "licenseExpression": "CC0-1.0",
    "licenseName": "Creative Commons CC0 1.0 Universal / US public-domain data",
    "licenseUrl": "https://creativecommons.org/publicdomain/zero/1.0/",
    "termsUrl": "https://fdc.nal.usda.gov/api-guide/",
    "commercialUseAllowed": true,
    "redistributionAllowed": true,
    "licenseAttributionRequired": false,
    "productAttributionRequired": true,
    "attributionFixture": "U.S. Department of Agriculture, Agricultural Research Service. FoodData Central. https://fdc.nal.usda.gov/ (source release: {{releaseKey}}).",
    "databaseRightsNotes": "USDA states FoodData Central data are public domain and published under CC0, while requesting that products identify FoodData Central as the source.",
    "review": {
      "status": "pending",
      "reviewedAt": null,
      "reviewedBy": null,
      "evidenceUrls": [
        "https://fdc.nal.usda.gov/api-guide/",
        "https://fdc.nal.usda.gov/data-documentation/",
        "https://fdc.nal.usda.gov/download-datasets/",
        "https://fdc.nal.usda.gov/log/",
        "https://fdc.nal.usda.gov/docs/Download_Field_Descriptions_Oct2020.pdf"
      ],
      "notes": "Official-source research is complete; named product-rights approval and acquisition verification are still required. Branded records must retain their original market and provider provenance."
    }
  },
  "ingestion": {
    "parserPackage": "@nutrition-tracker/ingestion",
    "parserVersion": null,
    "parserBuildSha256": null,
    "dataTypes": ["Foundation", "Experimental", "FNDDS", "SR Legacy", "Branded"],
    "languages": ["en"],
    "markets": ["US", "NZ"],
    "sourceIdentityFields": ["fdcId", "dataType"],
    "missingValuePolicy": "absent-is-unknown-never-zero"
  },
  "validation": {
    "rules": [
      "archive paths are safe and the extracted byte budget is bounded",
      "source IDs are unique within data type",
      "every nutrient ID maps explicitly or is quarantined",
      "original and canonical units and bases are retained",
      "missing branded label fields remain unknown",
      "GTIN assignments pass syntax and collision checks",
      "record counts and source-type mix are diffed against the prior release"
    ],
    "expectedFiles": [],
    "releaseSpecificExpectations": {
      "publisherReleaseLabel": "04/2026",
      "officialPublishedOn": "2026-04-30",
      "fdcReleaseVersion": "15.0",
      "publisherReportedCompressedSize": "460M",
      "publisherReportedUncompressedSize": "3.1G",
      "observedHeadContentLengthOn2026_08_15": 481510693,
      "foundationReleaseLabel": "04/2026",
      "brandedReleaseLabel": "04/2026",
      "fnddsReleaseLabel": "10/2024",
      "srLegacyReleaseLabel": "04/2018"
    }
  }
}
